{
    "$schema": "https://json-schema.org/draft/2020-12/schema",
    "$id": "https://json-schema.org/draft/2020-12/schema",
    "$vocabulary": {
        "https://json-schema.org/draft/2020-12/vocab/core": true,
        "https://json-schema.org/draft/2020-12/vocab/applicator": true,
        "https://json-schema.org/draft/2020-12/vocab/unevaluated": true,
        "https://json-schema.org/draft/2020-12/vocab/validation": true,
        "https://json-schema.org/draft/2020-12/vocab/meta-data": true,
        "https://json-schema.org/draft/2020-12/vocab/format-annotation": true,
        "https://json-schema.org/draft/2020-12/vocab/content": true
    },
    "$dynamicAnchor": "meta",
    "$recursiveAnchor": true,

    "$comment": "This is a flattened version of the official 2020-12 meta-schema for use by Jane. The official schema uses allOf with $ref to separate vocabulary files, which Jane cannot resolve. All vocabularies are inlined here. $dynamicRef/#meta references are replaced by $ref/# since Jane does not support $dynamicRef. Boolean schemas (true) are replaced by empty schemas ({}) for the same reason.",
    "title": "Core and Validation specifications meta-schema",
    "type": ["object", "boolean"],
    "properties": {
        "$id": {
            "$ref": "#/$defs/uriReferenceString",
            "$comment": "Non-empty fragments not allowed.",
            "pattern": "^[^#]*#?$"
        },
        "$schema": { "$ref": "#/$defs/uriString" },
        "$ref": { "$ref": "#/$defs/uriReferenceString" },
        "$anchor": { "$ref": "#/$defs/anchorString" },
        "$dynamicRef": { "$ref": "#/$defs/uriReferenceString" },
        "$dynamicAnchor": { "$ref": "#/$defs/anchorString" },
        "$vocabulary": {
            "type": "object",
            "propertyNames": { "$ref": "#/$defs/uriString" },
            "additionalProperties": {
                "type": "boolean"
            }
        },
        "$comment": {
            "type": "string"
        },
        "$defs": {
            "type": "object",
            "additionalProperties": { "$ref": "#" }
        },

        "prefixItems": { "$ref": "#/$defs/schemaArray" },
        "items": {
            "$comment": "In 2020-12, items is a single schema. The anyOf with schemaArray is kept for backward compatibility with draft-07/2019-09 tuple validation (items as array).",
            "anyOf": [
                { "$ref": "#" },
                { "$ref": "#/$defs/schemaArray" }
            ]
        },
        "contains": { "$ref": "#" },
        "additionalProperties": { "$ref": "#" },
        "properties": {
            "type": "object",
            "additionalProperties": { "$ref": "#" },
            "default": {}
        },
        "patternProperties": {
            "type": "object",
            "additionalProperties": { "$ref": "#" },
            "propertyNames": { "format": "regex" },
            "default": {}
        },
        "dependentSchemas": {
            "type": "object",
            "additionalProperties": { "$ref": "#" },
            "default": {}
        },
        "propertyNames": { "$ref": "#" },
        "if": { "$ref": "#" },
        "then": { "$ref": "#" },
        "else": { "$ref": "#" },
        "allOf": { "$ref": "#/$defs/schemaArray" },
        "anyOf": { "$ref": "#/$defs/schemaArray" },
        "oneOf": { "$ref": "#/$defs/schemaArray" },
        "not": { "$ref": "#" },

        "unevaluatedItems": { "$ref": "#" },
        "unevaluatedProperties": { "$ref": "#" },

        "type": {
            "anyOf": [
                { "$ref": "#/$defs/simpleTypes" },
                {
                    "type": "array",
                    "items": { "$ref": "#/$defs/simpleTypes" },
                    "minItems": 1,
                    "uniqueItems": true
                }
            ]
        },
        "const": {},
        "enum": {
            "type": "array",
            "items": {}
        },
        "multipleOf": {
            "type": "number",
            "exclusiveMinimum": 0
        },
        "maximum": {
            "type": "number"
        },
        "exclusiveMaximum": {
            "type": "number"
        },
        "minimum": {
            "type": "number"
        },
        "exclusiveMinimum": {
            "type": "number"
        },
        "maxLength": { "$ref": "#/$defs/nonNegativeInteger" },
        "minLength": { "$ref": "#/$defs/nonNegativeIntegerDefault0" },
        "pattern": {
            "type": "string",
            "format": "regex"
        },
        "maxItems": { "$ref": "#/$defs/nonNegativeInteger" },
        "minItems": { "$ref": "#/$defs/nonNegativeIntegerDefault0" },
        "uniqueItems": {
            "type": "boolean",
            "default": false
        },
        "maxContains": { "$ref": "#/$defs/nonNegativeInteger" },
        "minContains": {
            "$ref": "#/$defs/nonNegativeInteger",
            "default": 1
        },
        "maxProperties": { "$ref": "#/$defs/nonNegativeInteger" },
        "minProperties": { "$ref": "#/$defs/nonNegativeIntegerDefault0" },
        "required": { "$ref": "#/$defs/stringArray" },
        "dependentRequired": {
            "type": "object",
            "additionalProperties": {
                "$ref": "#/$defs/stringArray"
            }
        },

        "title": {
            "type": "string"
        },
        "description": {
            "type": "string"
        },
        "default": {},
        "deprecated": {
            "type": "boolean",
            "default": false
        },
        "readOnly": {
            "type": "boolean",
            "default": false
        },
        "writeOnly": {
            "type": "boolean",
            "default": false
        },
        "examples": {
            "type": "array",
            "items": {}
        },

        "format": { "type": "string" },

        "contentEncoding": { "type": "string" },
        "contentMediaType": { "type": "string" },
        "contentSchema": { "$ref": "#" },

        "definitions": {
            "$comment": "\"definitions\" has been replaced by \"$defs\".",
            "type": "object",
            "additionalProperties": { "$ref": "#" },
            "deprecated": true,
            "default": {}
        },
        "dependencies": {
            "$comment": "\"dependencies\" has been split and replaced by \"dependentSchemas\" and \"dependentRequired\" in order to serve their differing semantics.",
            "type": "object",
            "additionalProperties": {
                "anyOf": [
                    { "$ref": "#" },
                    { "$ref": "#/$defs/stringArray" }
                ]
            },
            "deprecated": true,
            "default": {}
        },
        "$recursiveAnchor": {
            "$comment": "\"$recursiveAnchor\" has been replaced by \"$dynamicAnchor\".",
            "type": "boolean",
            "deprecated": true,
            "default": false
        },
        "$recursiveRef": {
            "$comment": "\"$recursiveRef\" has been replaced by \"$dynamicRef\".",
            "$ref": "#/$defs/uriReferenceString",
            "deprecated": true
        },
        "additionalItems": {
            "$comment": "\"additionalItems\" has been replaced by \"prefixItems\" + \"items\". Kept for backward compatibility with draft-07/2019-09 schemas.",
            "$ref": "#",
            "deprecated": true
        }
    },
    "$defs": {
        "anchorString": {
            "type": "string",
            "pattern": "^[A-Za-z_][-A-Za-z0-9._]*$"
        },
        "uriString": {
            "type": "string",
            "format": "uri"
        },
        "uriReferenceString": {
            "type": "string",
            "format": "uri-reference"
        },
        "nonNegativeInteger": {
            "type": "integer",
            "minimum": 0
        },
        "nonNegativeIntegerDefault0": {
            "$ref": "#/$defs/nonNegativeInteger",
            "default": 0
        },
        "schemaArray": {
            "type": "array",
            "minItems": 1,
            "items": { "$ref": "#" }
        },
        "simpleTypes": {
            "enum": [
                "array",
                "boolean",
                "integer",
                "null",
                "number",
                "object",
                "string"
            ]
        },
        "stringArray": {
            "type": "array",
            "items": { "type": "string" },
            "uniqueItems": true,
            "default": []
        }
    }
}
