{
    "type": "object",
    "required": [
        "constString",
        "patternString"
    ],
    "properties": {
        "enumString": {
            "type": "string",
            "enum": ["foo", "bar", "baz"]
        },
        "enumArrayString": {
            "type": ["string"],
            "enum": ["foo", "bar", "baz"]
        },
        "enumNoType": {
            "enum": ["foo", "bar", "baz"]
        },
        "constString": {
            "type": "string",
            "const": "Michel"
        },
        "minLengthString": {
            "type": "string",
            "minLength": 10
        },
        "maxLengthString": {
            "type": "string",
            "maxLength": 36
        },
        "minMaxLengthString": {
            "type": "string",
            "minLength": 10,
            "maxLength": 36
        },
        "patternString": {
            "type": "string",
            "pattern": "[a-z0-9\\-]{36}"
        },
        "arrayMinItems": {
            "type": "array",
            "items": {
                "type": "string"
            },
            "minItems": 1
        },
        "arrayMaxItems": {
            "type": "array",
            "items": {
                "type": "string"
            },
            "maxItems": 5
        },
        "arrayMinMaxItems": {
            "type": "array",
            "items": {
                "type": "string"
            },
            "minItems": 1,
            "maxItems": 5
        },
        "arrayUnique": {
            "type": "array",
            "items": {
                "type": "string"
            },
            "uniqueItems": true
        },
        "numericMultipleOf": {
            "type": "integer",
            "multipleOf": 2
        },
        "numericMaximum": {
            "type": "integer",
            "maximum": 10
        },
        "numericExclusiveMaximum": {
            "type": "integer",
            "exclusiveMaximum": 10
        },
        "numericMinimum": {
            "type": "integer",
            "minimum": 10
        },
        "numericExclusiveMinimum": {
            "type": "integer",
            "exclusiveMinimum": 10
        },
        "emailFormat": {
            "type": "string",
            "format": "email"
        },
        "ipv4Format": {
            "type": "string",
            "format": "ipv4"
        },
        "ipv6Format": {
            "type": "string",
            "format": "ipv6"
        },
        "uriFormat": {
            "type": "string",
            "format": "uri"
        },
        "iriFormat": {
            "type": "string",
            "format": "iri"
        },
        "uuidFormat": {
            "type": "string",
            "format": "uuid"
        },
        "dateFormat": {
            "type": "string",
            "format": "date"
        },
        "dateNullableFormat": {
            "type": ["string", "null"],
            "format": "date"
        },
        "dateTimeFormat": {
            "type": "string",
            "format": "date-time"
        },
        "foo": {
            "$ref": "#/definitions/FooFooFoo"
        },
        "arrayEmptyItems": {
            "type": "array",
            "items": {}
        },
        "arrayBoolItems": {
            "type": "array",
            "items": true
        }
    },
    "definitions": {
        "FooFooFoo": {
            "type": "object",
            "properties": {
                "foo": {
                    "type": "string"
                }
            }
        }
    }
}
